{
  "catalog": "nekkora.protection-signatures",
  "catalogVersion": "2026.10.1",
  "reviewedAt": "2026-10-14",
  "notes": [
    "Catálogo DETERMINÍSTICO e explicável de evidências OBSERVÁVEIS no navegador. Não executa desafios, não gera tráfego e não contorna proteções.",
    "basis=OFFICIAL_DOCUMENTATION: indicadores conferidos na documentação pública do fornecedor na data de revisão. basis=THIRD_PARTY_OBSERVATION: indicadores de fontes secundárias, não confirmados pelo fornecedor; a confiança máxima é limitada.",
    "A ausência de assinaturas nunca significa ausência de proteção: proteções aplicadas no servidor ou na borda podem não deixar evidência no documento."
  ],
  "genericIndicators": [
    { "id": "generic.text.captcha", "kind": "TEXT", "token": "\\bcaptcha\\b", "strength": "WEAK", "signal": "MENTION", "description": "menção textual a CAPTCHA (não identifica fornecedor nem mecanismo)" },
    { "id": "generic.text.human-pt", "kind": "TEXT", "token": "(verifique|confirme|prove) (que )?(você )?(é|e) humano|não sou um robô|nao sou um robo", "strength": "WEAK", "signal": "MENTION", "description": "pedido genérico de verificação humana (português)" },
    { "id": "generic.text.human-en", "kind": "TEXT", "token": "verify (that )?you are (a )?human|i'?m not a robot|checking (if the site connection is secure|your browser)", "strength": "WEAK", "signal": "MENTION", "description": "pedido genérico de verificação humana (inglês)" },
    { "id": "generic.attr.sitekey", "kind": "DOM_ATTRIBUTE", "token": "data-sitekey", "strength": "WEAK", "signal": "WIDGET", "description": "atributo data-sitekey (comum a vários fornecedores de CAPTCHA)" }
  ],
  "signatures": [
    {
      "id": "google.recaptcha.v2",
      "provider": "GOOGLE", "product": "RECAPTCHA_V2", "category": "CAPTCHA",
      "signatureVersion": "1", "reviewedAt": "2026-10-14", "basis": "OFFICIAL_DOCUMENTATION",
      "sources": ["https://developers.google.com/recaptcha/docs/display"],
      "maxConfidence": "HIGH",
      "indicators": [
        { "id": "recaptcha.script", "kind": "SCRIPT_URL", "host": "^(www\\.)?(google\\.com|recaptcha\\.net)$", "path": "^/recaptcha/(api|enterprise)\\.js$", "strength": "STRONG", "signal": "TECHNOLOGY", "description": "script de integração do reCAPTCHA" },
        { "id": "recaptcha.widget", "kind": "DOM_CLASS", "token": "g-recaptcha", "strength": "STRONG", "signal": "WIDGET", "description": "contêiner do widget reCAPTCHA (classe g-recaptcha)" },
        { "id": "recaptcha.anchor-frame", "kind": "FRAME_URL", "host": "^(www\\.)?(google\\.com|recaptcha\\.net)$", "path": "^/recaptcha/(api2|enterprise)/anchor", "strength": "STRONG", "signal": "WIDGET", "description": "iframe da caixa de verificação do reCAPTCHA" },
        { "id": "recaptcha.challenge-frame", "kind": "FRAME_URL", "host": "^(www\\.)?(google\\.com|recaptcha\\.net)$", "path": "^/recaptcha/(api2|enterprise)/bframe", "strength": "STRONG", "signal": "CHALLENGE_ACTIVE", "description": "iframe do desafio do reCAPTCHA (ativo quando visível)" },
        { "id": "recaptcha.response", "kind": "FORM_FIELD", "token": "^g-recaptcha-response$", "strength": "MEDIUM", "signal": "COMPLETED_FIELD", "description": "campo de resposta g-recaptcha-response (valor nunca coletado; somente se está preenchido)" }
      ]
    },
    {
      "id": "google.recaptcha.v3",
      "provider": "GOOGLE", "product": "RECAPTCHA_V3", "category": "RISK_ASSESSMENT",
      "signatureVersion": "1", "reviewedAt": "2026-10-14", "basis": "OFFICIAL_DOCUMENTATION",
      "sources": ["https://developers.google.com/recaptcha/docs/v3"],
      "maxConfidence": "MEDIUM",
      "indicators": [
        { "id": "recaptcha3.script-render", "kind": "SCRIPT_URL", "host": "^(www\\.)?(google\\.com|recaptcha\\.net)$", "path": "^/recaptcha/(api|enterprise)\\.js$", "requiresQueryKey": "render", "strength": "STRONG", "signal": "TECHNOLOGY", "description": "script do reCAPTCHA carregado com parâmetro render (padrão do v3)" },
        { "id": "recaptcha3.badge", "kind": "DOM_CLASS", "token": "grecaptcha-badge", "strength": "MEDIUM", "signal": "TECHNOLOGY", "description": "selo do reCAPTCHA invisível/v3" }
      ]
    },
    {
      "id": "hcaptcha",
      "provider": "HCAPTCHA", "product": "HCAPTCHA", "category": "CAPTCHA",
      "signatureVersion": "1", "reviewedAt": "2026-10-14", "basis": "OFFICIAL_DOCUMENTATION",
      "sources": ["https://docs.hcaptcha.com/"],
      "maxConfidence": "HIGH",
      "indicators": [
        { "id": "hcaptcha.script", "kind": "SCRIPT_URL", "host": "^js\\.hcaptcha\\.com$", "path": "^/1/api\\.js$", "strength": "STRONG", "signal": "TECHNOLOGY", "description": "script de integração do hCaptcha" },
        { "id": "hcaptcha.widget", "kind": "DOM_CLASS", "token": "h-captcha", "strength": "STRONG", "signal": "WIDGET", "description": "contêiner do widget hCaptcha (classe h-captcha)" },
        { "id": "hcaptcha.frame", "kind": "FRAME_URL", "host": "(^|\\.)hcaptcha\\.com$", "path": "/captcha/", "strength": "STRONG", "signal": "WIDGET", "description": "iframe servido por *.hcaptcha.com" },
        { "id": "hcaptcha.challenge-frame", "kind": "FRAME_URL", "host": "(^|\\.)hcaptcha\\.com$", "path": "/captcha/", "requiresFragment": "frame=challenge", "strength": "STRONG", "signal": "CHALLENGE_ACTIVE", "description": "iframe de desafio do hCaptcha" },
        { "id": "hcaptcha.response", "kind": "FORM_FIELD", "token": "^h-captcha-response$", "strength": "MEDIUM", "signal": "COMPLETED_FIELD", "description": "campo de resposta h-captcha-response (valor nunca coletado)" }
      ]
    },
    {
      "id": "cloudflare.turnstile",
      "provider": "CLOUDFLARE", "product": "TURNSTILE", "category": "HUMAN_VERIFICATION",
      "signatureVersion": "1", "reviewedAt": "2026-10-14", "basis": "OFFICIAL_DOCUMENTATION",
      "sources": ["https://developers.cloudflare.com/turnstile/get-started/client-side-rendering/"],
      "maxConfidence": "HIGH",
      "indicators": [
        { "id": "turnstile.script", "kind": "SCRIPT_URL", "host": "^challenges\\.cloudflare\\.com$", "path": "^/turnstile/v0/api\\.js$", "strength": "STRONG", "signal": "TECHNOLOGY", "description": "script do Cloudflare Turnstile" },
        { "id": "turnstile.widget", "kind": "DOM_CLASS", "token": "cf-turnstile", "strength": "STRONG", "signal": "WIDGET", "description": "contêiner implícito do Turnstile (classe cf-turnstile)" },
        { "id": "turnstile.frame", "kind": "FRAME_URL", "host": "^challenges\\.cloudflare\\.com$", "path": "^/cdn-cgi/challenge-platform/", "strength": "STRONG", "signal": "WIDGET", "description": "iframe do widget servido por challenges.cloudflare.com" },
        { "id": "turnstile.response", "kind": "FORM_FIELD", "token": "^cf-turnstile-response$", "strength": "MEDIUM", "signal": "COMPLETED_FIELD", "description": "campo cf-turnstile-response (valor nunca coletado)" }
      ]
    },
    {
      "id": "cloudflare.challenge-page",
      "provider": "CLOUDFLARE", "product": "CHALLENGE_PAGE", "category": "CHALLENGE_PAGE",
      "signatureVersion": "1", "reviewedAt": "2026-10-14", "basis": "THIRD_PARTY_OBSERVATION",
      "sources": ["https://developers.cloudflare.com/cloudflare-challenges/challenge-types/challenge-pages/", "observação pública da estrutura da página intersticial (não especificada pelo fornecedor)"],
      "maxConfidence": "MEDIUM",
      "indicators": [
        { "id": "cfchl.platform-script", "kind": "SCRIPT_URL", "host": ".*", "path": "^/cdn-cgi/challenge-platform/h/", "strength": "STRONG", "signal": "CHALLENGE_PAGE", "description": "script da plataforma de desafios servido no próprio domínio (/cdn-cgi/challenge-platform/h/)" },
        { "id": "cfchl.form", "kind": "DOM_ID", "token": "^(challenge-form|challenge-running|challenge-stage)$", "strength": "MEDIUM", "signal": "CHALLENGE_PAGE", "description": "elementos da página de desafio" },
        { "id": "cfchl.title", "kind": "TITLE", "token": "^(just a moment|um momento)", "strength": "WEAK", "signal": "CHALLENGE_PAGE", "description": "título típico da página intersticial" }
      ]
    },
    {
      "id": "cloudflare.bot-management",
      "provider": "CLOUDFLARE", "product": "BOT_MANAGEMENT", "category": "BOT_MANAGEMENT",
      "signatureVersion": "1", "reviewedAt": "2026-10-14", "basis": "THIRD_PARTY_OBSERVATION",
      "sources": ["fontes secundárias citam /cdn-cgi/challenge-platform/scripts/jsd/main.js (JavaScript detections); não confirmado pelo fornecedor"],
      "maxConfidence": "MEDIUM",
      "indicators": [
        { "id": "cfbm.jsd", "kind": "SCRIPT_URL", "host": ".*", "path": "^/cdn-cgi/challenge-platform/scripts/jsd/", "strength": "STRONG", "signal": "TECHNOLOGY", "description": "script de JavaScript detections no próprio domínio" }
      ]
    },
    {
      "id": "cloudflare.block-page",
      "provider": "CLOUDFLARE", "product": "BLOCK_PAGE", "category": "ACCESS_BLOCK",
      "signatureVersion": "1", "reviewedAt": "2026-10-14", "basis": "THIRD_PARTY_OBSERVATION",
      "sources": ["observação pública das páginas de erro/bloqueio"],
      "maxConfidence": "MEDIUM",
      "indicators": [
        { "id": "cfblock.details", "kind": "DOM_ID", "token": "^cf-error-details$", "strength": "STRONG", "signal": "BLOCKED", "description": "bloco de detalhes da página de bloqueio" },
        { "id": "cfblock.wrapper", "kind": "DOM_ID", "token": "^cf-wrapper$", "strength": "MEDIUM", "signal": "BLOCKED", "description": "contêiner da página de bloqueio" }
      ]
    },
    {
      "id": "aws.waf.captcha",
      "provider": "AWS", "product": "WAF_CAPTCHA", "category": "CHALLENGE",
      "signatureVersion": "1", "reviewedAt": "2026-10-14", "basis": "OFFICIAL_DOCUMENTATION",
      "sources": ["https://docs.aws.amazon.com/waf/latest/developerguide/waf-js-captcha-api-specification.html", "https://docs.aws.amazon.com/waf/latest/developerguide/waf-javascript-api.html"],
      "maxConfidence": "HIGH",
      "indicators": [